{
  "schema_version": "auneya-witness-proof-v0.1",
  "proof_id": "auneya_proof_download_integrity_001",
  "proof_type": "prooflet",
  "claim_id": "auneya_claim_download_integrity_001",
  "claim_schema_version": "auneya-claim-v0.1",
  "claim_hash": "sha256:5555555555555555555555555555555555555555555555555555555555555555",
  "witness": {
    "witness_id": "witness_android_termux_001",
    "device_class": "android_termux",
    "environment_class": "phone_safe",
    "software_name": "wvp",
    "software_version": "research-v0.1"
  },
  "observed_status": "verified",
  "evidence": [
    {
      "evidence_type": "http_status",
      "evidence_hash": "sha256:6666666666666666666666666666666666666666666666666666666666666666",
      "evidence_locator": "https://example.com/file.tar.gz",
      "observed_at": "2026-10-06T00:01:05Z"
    },
    {
      "evidence_type": "content_hash",
      "evidence_hash": "sha256:7777777777777777777777777777777777777777777777777777777777777777",
      "evidence_locator": "https://example.com/file.tar.gz",
      "observed_at": "2026-10-06T00:01:10Z"
    }
  ],
  "lawful_boundary_confirmation": {
    "public_or_authorized_target": true,
    "no_private_data_accessed": true,
    "no_hacked_data_used": true,
    "no_paywall_bypass_used": true,
    "no_credentials_used": true,
    "no_surveillance_performed": true,
    "notes": "Only public download status and content hash were checked."
  },
  "timing": {
    "started_at": "2026-10-06T00:01:00Z",
    "completed_at": "2026-10-06T00:01:15Z",
    "duration_ms": 15000
  },
  "integrity": {
    "proof_hash": "sha256:8888888888888888888888888888888888888888888888888888888888888888",
    "signature_status": "unsigned_research_fixture"
  },
  "created_at": "2026-10-06T00:01:16Z",
  "non_value_notice": "This witness proof is protocol research and does not create a token, reward or market value."
}
